{
  "schema_version": "2.1",
  "run_id": "ofamas-three-gate",
  "recorded_by": "example-fixture",
  "gates": {
    "gate1": {
      "selected": [
        "LP-001",
        "LP-002",
        "LP-004"
      ],
      "mode": "example",
      "recommended_ids": [
        "LP-001",
        "LP-002",
        "LP-004"
      ],
      "not_selected_recommended": [],
      "recorded_at": null,
      "source": "05_human_selection.md"
    },
    "gate2": {
      "selected": [
        "LR-001",
        "LR-003",
        "LR-004",
        "LR-006"
      ],
      "mode": "example",
      "recommended_ids": [
        "LR-001",
        "LR-003",
        "LR-004",
        "LR-006"
      ],
      "not_selected_recommended": [],
      "wildcard_prompt_shown": false,
      "wildcard_added": false,
      "recorded_at": null,
      "source": "05_human_selection.md"
    },
    "gate3": {
      "selected": [
        {
          "audit_id": "VA-002",
          "resolution": "human_rescue_to_revise"
        },
        {
          "audit_id": "VA-003",
          "resolution": "human_rescue_to_revise"
        }
      ],
      "mode": "example",
      "recommended_ids": [
        "VA-002",
        "VA-003"
      ],
      "rejected_drawer_locked": [
        "VA-001",
        "VA-004"
      ],
      "recorded_at": null,
      "source": "05_human_selection.md"
    }
  }
}
